{
  "$schema": "https://json-schema.org/draft/2020-12/schema",
  "$id": "https://talli.no/schemas/architecture/module.schema.json",
  "title": "Talli module manifest",
  "type": "object",
  "required": ["schemaVersion", "kind", "name", "path", "owner", "purpose", "documentation", "publicEntryPoint", "dependencies", "allowedImports", "forbiddenResponsibilities", "tests", "compatibilityExceptions"],
  "properties": {
    "schemaVersion": { "const": "1.0" },
    "kind": { "enum": ["backend-capability", "backend-technical-module", "web-feature"] },
    "name": { "type": "string", "pattern": "^[a-z][a-z0-9_-]*$" },
    "path": { "type": "string", "minLength": 1 },
    "owner": { "type": "string", "minLength": 1 },
    "purpose": { "type": "string", "minLength": 1 },
    "documentation": { "type": "string", "pattern": "MODULE\\.md$" },
    "publicEntryPoint": { "type": "string", "minLength": 1 },
    "publicImportPaths": { "$ref": "#/$defs/stringArray" },
    "dependencies": { "type": "array", "items": { "$ref": "#/$defs/dependency" } },
    "allowedImports": { "$ref": "#/$defs/stringArray" },
    "forbiddenResponsibilities": { "$ref": "#/$defs/nonEmptyStringArray" },
    "tests": { "type": "object", "required": ["architecture"], "additionalProperties": { "type": "string", "minLength": 1 } },
    "compatibilityExceptions": { "type": "array", "items": { "type": "string", "pattern": "^compat-" }, "uniqueItems": true },
    "exports": { "type": "object", "required": ["commands", "queries", "events", "errors", "identifiers"], "properties": { "commands": { "$ref": "#/$defs/stringArray" }, "queries": { "$ref": "#/$defs/stringArray" }, "events": { "$ref": "#/$defs/stringArray" }, "errors": { "$ref": "#/$defs/stringArray" }, "identifiers": { "$ref": "#/$defs/stringArray" } }, "additionalProperties": false },
    "owns": { "type": "object", "required": ["postgresSchemas", "tables", "storageBuckets", "projections", "migrations"], "properties": { "postgresSchemas": { "$ref": "#/$defs/stringArray" }, "tables": { "$ref": "#/$defs/stringArray" }, "storageBuckets": { "$ref": "#/$defs/stringArray" }, "projections": { "$ref": "#/$defs/stringArray" }, "migrations": { "type": "string", "minLength": 1 } }, "additionalProperties": false },
    "ports": { "type": "array", "items": { "type": "object", "required": ["name", "direction", "contract", "registrationDecorator", "adapters"], "properties": { "name": { "type": "string", "minLength": 1 }, "direction": { "const": "outbound" }, "contract": { "type": "string", "pattern": "^talli_backend\\." }, "registrationDecorator": { "type": "string", "pattern": "^talli_backend\\." }, "adapters": { "$ref": "#/$defs/stringArray" } }, "additionalProperties": false } },
    "ownedRoutes": { "$ref": "#/$defs/stringArray" },
    "apiOperations": { "$ref": "#/$defs/stringArray" },
    "cachePolicy": { "type": "object", "required": ["default", "allowed"], "properties": { "default": { "const": "no-store" }, "allowed": { "$ref": "#/$defs/stringArray" } }, "additionalProperties": false },
    "directBrowserFlows": { "type": "array", "items": { "type": "object", "required": ["name", "scope", "reviewCondition"], "properties": { "name": { "type": "string" }, "scope": { "type": "string" }, "reviewCondition": { "type": "string" } }, "additionalProperties": false } }
  },
  "allOf": [
    { "if": { "properties": { "kind": { "const": "backend-capability" } } }, "then": { "required": ["exports", "owns", "ports"], "properties": { "path": { "pattern": "^apps/backend/src/talli_backend/modules/[a-z][a-z0-9_]*$" }, "publicEntryPoint": { "pattern": "^talli_backend\\.modules\\.[a-z][a-z0-9_]*\\.public$" }, "dependencies": { "items": { "properties": { "kind": { "enum": ["command", "query", "event"] } } } } }, "not": { "anyOf": [{ "required": ["ownedRoutes"] }, { "required": ["apiOperations"] }, { "required": ["cachePolicy"] }, { "required": ["directBrowserFlows"] }, { "required": ["publicImportPaths"] }] } } },
    { "if": { "properties": { "kind": { "const": "backend-technical-module" } } }, "then": { "required": ["exports", "owns", "ports"], "properties": { "owner": { "pattern": "^backend-system:" }, "path": { "pattern": "^apps/backend/src/talli_backend/modules/[a-z][a-z0-9_]*$" }, "publicEntryPoint": { "pattern": "^talli_backend\\.modules\\.[a-z][a-z0-9_]*\\.public$" }, "dependencies": { "maxItems": 0 }, "owns": { "properties": { "postgresSchemas": { "maxItems": 0 }, "tables": { "maxItems": 0 }, "storageBuckets": { "maxItems": 0 }, "projections": { "maxItems": 0 }, "migrations": { "const": "None" } } } }, "not": { "anyOf": [{ "required": ["ownedRoutes"] }, { "required": ["apiOperations"] }, { "required": ["cachePolicy"] }, { "required": ["directBrowserFlows"] }, { "required": ["publicImportPaths"] }] } } },
    { "if": { "properties": { "kind": { "const": "web-feature" } } }, "then": { "required": ["ownedRoutes", "apiOperations", "cachePolicy", "directBrowserFlows", "publicImportPaths"], "properties": { "path": { "pattern": "^apps/web/features/[a-z][a-z0-9-]*$" }, "publicEntryPoint": { "pattern": "^@/features/[a-z][a-z0-9-]*$" }, "dependencies": { "items": { "properties": { "kind": { "const": "feature" } } } } }, "not": { "anyOf": [{ "required": ["exports"] }, { "required": ["owns"] }, { "required": ["ports"] }] } } }
  ],
  "$defs": {
    "stringArray": { "type": "array", "items": { "type": "string", "minLength": 1 }, "uniqueItems": true },
    "nonEmptyStringArray": { "type": "array", "items": { "type": "string", "minLength": 1 }, "minItems": 1, "uniqueItems": true },
    "dependency": { "type": "object", "required": ["module", "kind", "imports"], "properties": { "module": { "type": "string", "minLength": 1 }, "kind": { "enum": ["command", "query", "event", "feature"] }, "imports": { "$ref": "#/$defs/nonEmptyStringArray" } }, "additionalProperties": false }
  },
  "additionalProperties": false
}
