{
  "schemaVersion": "1.0",
  "kind": "backend-capability",
  "name": "documents",
  "path": "apps/backend/src/talli_backend/modules/documents",
  "owner": "backend:documents",
  "purpose": "Own accounting-document validation, metadata, private single-object transfers, integrity, retention, safe removal, and backup projections.",
  "documentation": "apps/backend/src/talli_backend/modules/documents/MODULE.md",
  "publicEntryPoint": "talli_backend.modules.documents.public",
  "exports": {
    "commands": [
      "BeginDocumentUploadCommand",
      "DocumentEvidenceRetentionCommand",
      "DocumentDisposition"
    ],
    "queries": [
      "DocumentBackupObject",
      "DocumentBindingQuery",
      "DocumentObjectTransfer",
      "DocumentRecord",
      "DocumentRestoreObject",
      "DocumentRestorePlan",
      "DocumentUploadTransfer",
      "VerifiedDocumentEvidence",
      "document_metadata_sha256",
      "RetainedDocumentOriginalReceipt",
      "RetainedDocumentOriginal",
      "RetainedDocumentOriginalQuery",
      "RetainedDocumentOriginalSnapshot",
      "serialize_retained_document_original",
      "parse_retained_document_original",
      "dispose_document",
      "validate_document_dispositions",
      "apply_document_dispositions"
    ],
    "events": [],
    "errors": [
      "DocumentsError",
      "DocumentErrorCode"
    ],
    "identifiers": [
      "DocumentBindingPersistence",
      "DocumentId",
      "DocumentObjectStorage",
      "DocumentStatus",
      "DocumentTransferKind",
      "DocumentsAuthorization",
      "DocumentsPersistence",
      "DocumentsSession",
      "DocumentsSessionFactory",
      "StoredDocumentObject",
      "document_binding_persistence_adapter",
      "document_object_storage_adapter",
      "documents_authorization_adapter",
      "documents_persistence_adapter",
      "DocumentEvidenceRetentionPersistence",
      "document_evidence_retention_adapter",
      "DocumentOriginalPersistence",
      "document_original_persistence_adapter",
      "DocumentDispositionStore",
      "document_disposition_adapter"
    ]
  },
  "owns": {
    "postgresSchemas": [
      "documents"
    ],
    "tables": [
      "documents.evidence_references",
      "public.documents",
      "documents.retained_originals",
      "documents.local_native_disposition_plans",
      "documents.local_native_disposition_targets",
      "documents.local_native_disposition_receipts"
    ],
    "storageBuckets": [
      "company-documents"
    ],
    "projections": [
      "DocumentBackupObject"
    ],
    "migrations": "supabase/migrations/20260902030000_documents_evidence_reference_registry.sql; supabase/migrations/20260923102419_documents_verified_rf_evidence_retention.sql; supabase/migrations/20260923125730_documents_ledger_evidence_guard.sql; supabase/migrations/20260924062717_documents_immutable_retained_originals.sql; supabase/migrations/20260924080249_documents_rf_consequential_company_guards.sql; supabase/migrations/20260928083000_documents_historical_original_recovery.sql; supabase/migrations/20260928124000_documents_historical_original_assertion.sql; supabase/migrations/20261009232839_documents_historical_original_integrity.sql; supabase/migrations/20261028042019_documents_local_native_disposition.sql"
  },
  "ports": [
    {
      "name": "DocumentsPersistence",
      "direction": "outbound",
      "contract": "talli_backend.modules.documents.public.DocumentsPersistence",
      "registrationDecorator": "talli_backend.modules.documents.public.documents_persistence_adapter",
      "adapters": [
        "talli_backend.adapters.supabase_documents.SupabaseDocumentsPersistence"
      ]
    },
    {
      "name": "DocumentObjectStorage",
      "direction": "outbound",
      "contract": "talli_backend.modules.documents.public.DocumentObjectStorage",
      "registrationDecorator": "talli_backend.modules.documents.public.document_object_storage_adapter",
      "adapters": [
        "talli_backend.adapters.supabase_documents.SupabaseDocumentObjectStorage"
      ]
    },
    {
      "name": "DocumentsAuthorization",
      "direction": "outbound",
      "contract": "talli_backend.modules.documents.public.DocumentsAuthorization",
      "registrationDecorator": "talli_backend.modules.documents.public.documents_authorization_adapter",
      "adapters": [
        "talli_backend.adapters.supabase_documents.SupabaseDocumentsAuthorization"
      ]
    },
    {
      "name": "DocumentBindingPersistence",
      "direction": "outbound",
      "contract": "talli_backend.modules.documents.public.DocumentBindingPersistence",
      "registrationDecorator": "talli_backend.modules.documents.public.document_binding_persistence_adapter",
      "adapters": [
        "talli_backend.adapters.postgres_company_tax_filing.PostgresCompanyTaxTransaction"
      ]
    },
    {
      "name": "DocumentEvidenceRetentionPersistence",
      "direction": "outbound",
      "contract": "talli_backend.modules.documents.public.DocumentEvidenceRetentionPersistence",
      "registrationDecorator": "talli_backend.modules.documents.public.document_evidence_retention_adapter",
      "adapters": [
        "talli_backend.adapters.postgres_document_evidence.PostgresDocumentEvidenceRetention"
      ]
    },
    {
      "name": "DocumentOriginalPersistence",
      "direction": "outbound",
      "contract": "talli_backend.modules.documents.public.DocumentOriginalPersistence",
      "registrationDecorator": "talli_backend.modules.documents.public.document_original_persistence_adapter",
      "adapters": [
        "talli_backend.adapters.postgres_document_originals.PostgresDocumentOriginals"
      ]
    },
    {
      "name": "DocumentDispositionStore",
      "direction": "outbound",
      "contract": "talli_backend.modules.documents.public.DocumentDispositionStore",
      "registrationDecorator": "talli_backend.modules.documents.public.document_disposition_adapter",
      "adapters": [
        "talli_backend.adapters.postgres_document_disposition.PostgresDocumentDisposition"
      ]
    }
  ],
  "dependencies": [],
  "allowedImports": [
    "__future__",
    "collections.abc",
    "dataclasses",
    "datetime",
    "enum",
    "hashlib",
    "json",
    "re",
    "talli_backend.shared.kernel",
    "typing",
    "unicodedata",
    "uuid",
    "base64"
  ],
  "forbiddenResponsibilities": [
    "Corporate-governance, filing, ledger, investment, authority, or archive composition policy",
    "Provider-specific object policy in the public contract",
    "Direct browser metadata mutation, bucket listing, arbitrary object keys, or unreviewed object deletion"
  ],
  "tests": {
    "policy": "apps/backend/tests/test_documents.py",
    "adapter": "apps/backend/tests/test_supabase_documents.py",
    "database": "tests/documents_database_runtime.test.mjs",
    "architecture": "tests/architecture_foundation.test.mjs",
    "evidenceRetention": "apps/backend/tests/test_document_evidence_retention.py",
    "evidenceRetentionDatabase": "apps/backend/tests/test_document_evidence_retention_database.py",
    "retainedOriginals": "apps/backend/tests/test_document_originals.py",
    "retainedOriginalsDatabase": "apps/backend/tests/test_document_originals_database.py",
    "companyGuardDatabase": "apps/backend/tests/test_documents_rf_company_guard_database.py",
    "companyGuardAdapter": "apps/backend/tests/test_consequential_adapter_guards.py",
    "originalArchive": "apps/backend/tests/test_document_original_archive.py",
    "historicalOriginalIntegrityCodec": "apps/backend/tests/test_documents_historical_original_integrity_codec.py",
    "historicalOriginalIntegrityDatabase": "apps/backend/tests/test_documents_historical_original_integrity_database.py",
    "disposition": "apps/backend/tests/test_deletion_replay.py"
  },
  "compatibilityExceptions": []
}
