{
  "schemaVersion": "1.0",
  "kind": "web-feature",
  "name": "shareholder-register-filing",
  "path": "apps/web/features/shareholder-register-filing",
  "owner": "web:shareholder-register-filing",
  "purpose": "Present RF-1086 owned previews, review, simulation, approval and retained production history through generated authenticated transport.",
  "documentation": "apps/web/features/shareholder-register-filing/MODULE.md",
  "publicEntryPoint": "@/features/shareholder-register-filing",
  "publicImportPaths": [
    "@/features/shareholder-register-filing",
    "apps/web/features/shareholder-register-filing",
    "apps/web/features/shareholder-register-filing/index.ts"
  ],
  "ownedRoutes": [
    "/filing/aksjonaerregisteroppgaven/source",
    "/filing/aksjonaerregisteroppgaven/source/archive",
    "/filing/aksjonaerregisteroppgaven/register"
  ],
  "apiOperations": [
    "legacyRf1086ReconcileFeedback",
    "legacyRf1086SendApprovedFiling",
    "rf1086AcknowledgeReviewComment",
    "rf1086AddReviewComment",
    "rf1086ApproveProduction",
    "rf1086ApproveSourceProduction",
    "rf1086CaptureRegisterObservation",
    "rf1086CaptureYearSource",
    "rf1086ConfirmFilingPermission",
    "rf1086ConfirmSimulation",
    "rf1086GeneratePreview",
    "rf1086GenerateSourcePreview",
    "rf1086GetArchiveSource",
    "rf1086DownloadProductionArchive",
    "rf1086GetProductionArchiveSource",
    "rf1086ListRegisterObservations",
    "rf1086PrepareSourceProductionReview",
    "rf1086Preview",
    "rf1086ReadCurrentYearSource",
    "rf1086ReadSourceDocument",
    "rf1086ReadSourceIntakeBasis",
    "rf1086ReadSourcePreview",
    "rf1086RecordOverride",
    "rf1086RecordTestEvidence",
    "rf1086Workspace",
    "rf1086SendSourceProduction",
    "rf1086ReadSourceProductionPosition",
    "rf1086GetProductionArchiveSourceV4",
    "rf1086DownloadProductionArchiveV4",
    "rf1086LookupYearSourceCapture",
    "rf1086LookupRegisterObservationCapture",
    "rf1086ReadRegisterObservationLifecycle"
  ],
  "dependencies": [],
  "allowedImports": [
    "#backend-configuration",
    "@talli/talli-api-client"
  ],
  "cachePolicy": {
    "default": "no-store",
    "allowed": []
  },
  "directBrowserFlows": [],
  "forbiddenResponsibilities": [
    "Authority credentials or arbitrary HTTP/XML provider transport",
    "Filing journal, billing or feedback policy",
    "Direct business persistence"
  ],
  "tests": {
    "architecture": "tests/architecture_foundation.test.mjs",
    "sourceTransport": "apps/web/tests/shareholder-register-source-transport.test.mjs",
    "sourceApprovalControl": "apps/web/tests/shareholder-register-source-approval-control.test.mjs",
    "registerObservationLifecycleTransport": "apps/web/tests/shareholder-register-lifecycle-transport.test.mjs"
  },
  "compatibilityExceptions": []
}
